{
  "fixture": {
    "dial_indicator_resolution_mm": 0.01,
    "span_mm": 400.0,
    "support_type": "unknown"
  },
  "provenance": {
    "captured_at_utc": "2025-12-29T03:02:15Z",
    "tool_id": "tap_tone_pi",
    "tool_version": "v1.0"
  },
  "readings": {
    "csv_relpath": "raw/readings.csv",
    "replicates": [
      {
        "csv_relpath": "raw/replicates/replicate_01.csv",
        "rows": [
          {
            "deflection": 0.22,
            "load": 5.0
          },
          {
            "deflection": 0.44,
            "load": 10.0
          },
          {
            "deflection": 0.66,
            "load": 15.0
          }
        ]
      },
      {
        "csv_relpath": "raw/replicates/replicate_02.csv",
        "rows": [
          {
            "deflection": 0.21,
            "load": 5.0
          },
          {
            "deflection": 0.43,
            "load": 10.0
          },
          {
            "deflection": 0.65,
            "load": 15.0
          }
        ]
      },
      {
        "csv_relpath": "raw/replicates/replicate_03.csv",
        "rows": [
          {
            "deflection": 0.23,
            "load": 5.0
          },
          {
            "deflection": 0.45,
            "load": 10.0
          },
          {
            "deflection": 0.67,
            "load": 15.0
          }
        ]
      }
    ],
    "rows": [
      {
        "deflection": 0.22,
        "load": 5.0
      },
      {
        "deflection": 0.44,
        "load": 10.0
      },
      {
        "deflection": 0.66,
        "load": 15.0
      }
    ]
  },
  "results": {
    "ei_method_assumptions": "EI computed using three-point bending small-deflection formula: EI=(P/\u03b4)*L^3/48. Assumes central load, linear elastic response, negligible shear deflection.",
    "ei_n_mm2": 30303030.3030303,
    "k_force_per_deflection": 22.727272727272727,
    "k_r2": 1.0,
    "uncertainty": {
      "ci_level": 0.95,
      "ei_n_mm2": {
        "ci_high": 30303030.3030303,
        "ci_low": 30303030.3030303,
        "mean": 30303030.3030303,
        "n": 3,
        "se": 0.0,
        "std": 0.0
      },
      "inputs": {
        "dial_resolution_mm": 0.01,
        "replicates": 3
      },
      "k": {
        "ci_high": 22.727272727272734,
        "ci_low": 22.727272727272727,
        "mean": 22.72727272727273,
        "n": 3,
        "se": 2.51214793389404e-15,
        "std": 4.351167857633658e-15
      },
      "method": "replicates_normal_approx"
    },
    "warnings": []
  },
  "schema": {
    "created_at_utc": "2025-12-29T03:02:15Z",
    "name": "bending_stiffness",
    "version": "1.1"
  },
  "specimen": {
    "grain_orientation": "longitudinal",
    "material_role": "top",
    "specimen_id": "TOP_OM_001"
  },
  "test": {
    "method": "three_point_bending",
    "test_id": "bend_20251229T030215Z",
    "units": {
      "force": "N",
      "length": "mm"
    }
  }
}