{
  "calibration": {
    "dial": {
      "method": "tare_block",
      "zeroed": true,
      "zeroed_at_utc": "2025-12-29T04:21:48Z"
    },
    "load_cell": {
      "calibration_date_utc": "2025-11-15",
      "calibration_provider": "XYZ Metrology",
      "certificate_id": "CERT-88421",
      "present": true
    },
    "session_ref": {
      "session_calibration_relpath": "calibration/session_calibration.json",
      "session_id": "S_20251229_A"
    },
    "standard_specimen": {
      "expected_k": 22.0,
      "observed_k": 22.4,
      "pass": true,
      "specimen_id": "STD_STRIP_01",
      "tolerance": 0.7,
      "used": true
    }
  },
  "fixture": {
    "span_mm": 400.0,
    "support_type": "unknown"
  },
  "provenance": {
    "captured_at_utc": "2025-12-29T04:25:54Z",
    "operator": "Ross",
    "tool_id": "tap_tone_pi",
    "tool_version": "v1.0"
  },
  "readings": {
    "csv_relpath": "raw/readings.csv",
    "replicates": [
      {
        "csv_relpath": "raw/replicates/replicate_01.csv",
        "rows": [
          {
            "deflection": 0.25,
            "load": 6.0
          },
          {
            "deflection": 0.51,
            "load": 12.0
          },
          {
            "deflection": 0.77,
            "load": 18.0
          }
        ]
      }
    ],
    "rows": [
      {
        "deflection": 0.25,
        "load": 6.0
      },
      {
        "deflection": 0.51,
        "load": 12.0
      },
      {
        "deflection": 0.77,
        "load": 18.0
      }
    ]
  },
  "results": {
    "ei_method_assumptions": "EI computed using three-point bending small-deflection formula: EI=(P/\u03b4)*L^3/48. Assumes central load, linear elastic response, negligible shear deflection.",
    "ei_n_mm2": 30769230.769230768,
    "k_force_per_deflection": 23.076923076923077,
    "k_r2": 1.0,
    "warnings": []
  },
  "schema": {
    "created_at_utc": "2025-12-29T04:25:54Z",
    "name": "bending_stiffness",
    "version": "1.1"
  },
  "specimen": {
    "grain_orientation": "unknown",
    "material_role": "unknown",
    "specimen_id": "TOP_OM_003"
  },
  "test": {
    "method": "three_point_bending",
    "test_id": "bend_20251229T042554Z",
    "units": {
      "force": "N",
      "length": "mm"
    }
  }
}